{
  "id": "wizard",
  "name": "Wizard",
  "description": "A scholar of magic who reshapes a fight from the back line.",
  "hitDie": 6,
  "bonusHp": 2,
  "speed": 30,
  "dcAbility": "int",
  "proficiencyRanks": { "weapons": "trained", "dc": "trained", "int": "trained", "wis": "trained" },
  "proficiencies": [
    "weapons",
    "arcana",
    "investigation"
  ],
  "items": [
    "quarterstaff",
    "healing-potion"
  ],
  "levels": [
    { "slots": { "1": 2 }, "features": [{ "id": "arcane-recovery", "name": "Arcane Recovery", "description": "Once a long rest, win back some spent magic.", "resources": { "arcane-recovery": 1 } }] },
    { "feats": ["class"], "slots": { "1": 3 } },
    { "skills": 1, "slots": { "1": 4, "2": 2 } },
    { "feats": ["skill"], "slots": { "1": 4, "2": 3 } },
    { "slots": { "1": 4, "2": 3, "3": 2 }, "features": [{ "id": "sharpened-focus", "name": "Sharpened Focus", "description": "+1 to the DCs of what they cast.", "modifiers": [{ "stat": "dc", "value": 1 }] }] },
    { "feats": ["class"], "slots": { "1": 4, "2": 3, "3": 3 } },
    { "skills": 1, "slots": { "1": 4, "2": 3, "3": 3, "4": 1 }, "ranks": { "dc": "expert" } },
    { "feats": ["general"], "slots": { "1": 4, "2": 3, "3": 3, "4": 2 } },
    { "slots": { "1": 4, "2": 3, "3": 3, "4": 3, "5": 1 }, "ranks": { "wis": "expert" } },
    { "feats": ["class"], "slots": { "1": 4, "2": 3, "3": 3, "4": 3, "5": 2 }, "ranks": { "arcana": "expert" } },
    { "skills": 1, "slots": { "1": 4, "2": 3, "3": 3, "4": 3, "5": 2, "6": 1 }, "ranks": { "int": "expert" } },
    { "feats": ["skill"], "slots": { "1": 4, "2": 3, "3": 3, "4": 3, "5": 2, "6": 1 } },
    { "slots": { "1": 4, "2": 3, "3": 3, "4": 3, "5": 2, "6": 1, "7": 1 }, "features": [{ "id": "arcane-ward", "name": "Arcane Ward", "description": "A shimmer of protection: +1 AC.", "modifiers": [{ "stat": "ac", "value": 1 }] }] },
    { "feats": ["class"], "slots": { "1": 4, "2": 3, "3": 3, "4": 3, "5": 2, "6": 1, "7": 1 } },
    { "skills": 1, "slots": { "1": 4, "2": 3, "3": 3, "4": 3, "5": 2, "6": 1, "7": 1, "8": 1 }, "ranks": { "dc": "master" } },
    { "feats": ["general"], "slots": { "1": 4, "2": 3, "3": 3, "4": 3, "5": 2, "6": 1, "7": 1, "8": 1 } },
    { "slots": { "1": 4, "2": 3, "3": 3, "4": 3, "5": 2, "6": 1, "7": 1, "8": 1, "9": 1 }, "ranks": { "int": "master" } },
    { "feats": ["class"], "slots": { "1": 4, "2": 3, "3": 3, "4": 3, "5": 3, "6": 1, "7": 1, "8": 1, "9": 1 }, "features": [{ "id": "spell-mastery", "name": "Spell Mastery", "description": "+1 more to the DCs of what they cast.", "modifiers": [{ "stat": "dc", "value": 1 }] }] },
    { "skills": 1, "slots": { "1": 4, "2": 3, "3": 3, "4": 3, "5": 3, "6": 2, "7": 1, "8": 1, "9": 1 }, "ranks": { "dc": "legendary" } },
    { "feats": ["skill"], "slots": { "1": 4, "2": 3, "3": 3, "4": 3, "5": 3, "6": 2, "7": 2, "8": 1, "9": 1 } }
  ]
}
