{
  "id": "druid",
  "name": "Druid",
  "description": "A keeper of the old ways and the wild's magic.",
  "hitDie": 8,
  "bonusHp": 0,
  "speed": 30,
  "dcAbility": "wis",
  "proficiencies": [
    "weapons",
    "armor",
    "int",
    "wis",
    "nature",
    "medicine"
  ],
  "items": [
    "quarterstaff",
    "leather",
    "shield"
  ],
  "casting": "prepared",
  "spells": {
    "0": [
      "produce-flame",
      "poison-spray"
    ],
    "1": [
      "cure-wounds",
      "healing-word",
      "thunderwave",
      "entangle",
      "faerie-fire",
      "charm-person"
    ],
    "2": [
      "lesser-restoration",
      "hold-person",
      "moonbeam"
    ],
    "3": [
      "call-lightning"
    ]
  },
  "levels": [
    {
      "slots": {
        "1": 2
      },
      "spells": 4
    },
    {
      "slots": {
        "1": 3
      },
      "spells": 5
    },
    {
      "slots": {
        "1": 4,
        "2": 2
      },
      "spells": 6
    },
    {
      "slots": {
        "1": 4,
        "2": 3
      },
      "spells": 7,
      "boosts": 2,
      "boostStep": 1,
      "boostsRepeat": true
    },
    {
      "slots": {
        "1": 4,
        "2": 3,
        "3": 2
      },
      "spells": 9
    }
  ]
}
