{
  "id": "cleric",
  "name": "Cleric",
  "description": "A divine caster who heals and protects.",
  "hitDie": 8,
  "bonusHp": 0,
  "speed": 25,
  "dcAbility": "wis",
  "proficiencyRanks": {
    "weapons": "trained",
    "armor": "trained",
    "fortitude": "trained",
    "reflex": "trained",
    "will": "expert",
    "perception": "trained",
    "dc": "trained",
    "religion": "trained",
    "medicine": "trained"
  },
  "proficiencies": [
    "weapons",
    "religion"
  ],
  "items": [
    "staff",
    "studded-leather"
  ],
  "levels": [
    {
      "slots": {
        "1": 2
      },
      "spells": 2
    },
    {
      "slots": {
        "1": 3
      }
    },
    {
      "slots": {
        "1": 3,
        "2": 2
      },
      "skills": 1,
      "ranks": {
        "fortitude": "expert"
      },
      "features": [
        {
          "id": "second-doctrine",
          "name": "Second Doctrine",
          "description": "Fortitude saves become expert."
        }
      ]
    },
    {
      "slots": {
        "1": 3,
        "2": 3
      }
    },
    {
      "boosts": 4,
      "boostStep": 2,
      "slots": {
        "1": 3,
        "2": 3,
        "3": 2
      },
      "skills": 1,
      "ranks": {
        "perception": "expert"
      },
      "features": [
        {
          "id": "perception-expertise",
          "name": "Perception Expertise",
          "description": "Perception becomes expert."
        }
      ]
    }
  ],
  "casting": "prepared",
  "spells": {
    "0": [
      "divine-lance"
    ],
    "1": [
      "heal",
      "fear"
    ]
  }
}
